{
  "$schema":"./schemas/module-contract.schema.json",
  "contract_version":"0.2.0-draft",
  "module_id":"control-tower",
  "status":"Testing",
  "owner":"Control Tower & Master Architect",
  "reviewer":"Independent Control Tower Reviewer",
  "branch":"nexus-v2-p1-01-control-tower",
  "allowed_files":["nexus-v2-control-tower/**"],
  "inputs":[
    {"name":"Nexus V2 canonical","kind":"file","version":"0.2","owner":"Nicolas Goureau","schema_ref":null,"data_classification":"internal","retention":"permanent","compatibility_policy":"Explicit Nicolas decisions override this input"}
  ],
  "outputs":[
    {"name":"Module contract schema","kind":"schema","version":"0.2.0-draft","owner":"control-tower","schema_ref":"./schemas/module-contract.schema.json","data_classification":"internal","retention":"permanent","compatibility_policy":"Closed top level; breaking fields require a new major version"},
    {"name":"Nexus domain event","kind":"event","version":"1.0.0-draft","owner":"control-tower","schema_ref":"./schemas/domain-event.schema.json","data_classification":"internal","retention":"defined by producing module and Managed Ops policy","compatibility_policy":"Native CloudEvents 1.0; event type major version is authoritative"}
  ],
  "owned_data":[
    {"name":"module registry","data_classification":"internal","retention":"permanent","compatibility_policy":"Reconciled changes only"},
    {"name":"architecture decisions and change requests","data_classification":"internal","retention":"permanent","compatibility_policy":"Append/supersede; do not rewrite history"}
  ],
  "prohibited_ownership":["client business data","credentials","billing ledger","customer identity lifecycle","project lifecycle"],
  "dependencies":[],
  "non_goals":["business module implementation","production deployment","Old Nexus migration","runtime vendor selection"],
  "acceptance_criteria":[
    {"id":"CT-001","statement":"All JSON artifacts parse and schemas pass metaschema validation","evidence":"tests/validate-contracts.sh exit 0","status":"Passed"},
    {"id":"CT-002","statement":"Registry has 13 unique modules with resolved acyclic dependencies","evidence":"tests/validate-contracts.sh exit 0, including duplicate negative fixture","status":"Passed"},
    {"id":"CT-003","statement":"Tenant and system event fixtures enforce scope and CloudEvents attributes","evidence":"tests/validate-contracts.sh exit 0 with valid and expected-invalid fixtures","status":"Passed"},
    {"id":"CT-004","statement":"Completion semantic gate rejects false completion","evidence":"tests/validate-contracts.sh exit 0 with synthetic false-completion fixture","status":"Passed"},
    {"id":"CT-005","statement":"Independent review has no unresolved blocking findings","evidence":"Re-review pending","status":"Testing"}
  ],
  "research_records":[
    {"name":"CloudEvents","url":"https://github.com/cloudevents/spec","license":"Apache-2.0","commercial_use":"Permitted with license obligations","version_or_commit":"v1.0.2","maintenance":"Established CNCF specification","security":"Payload authorization remains application responsibility","integration_effort":"Low to moderate","lock_in":"Low; vendor-neutral","decision":"USE","custom_gap":"Nexus scope, actor, tenant, classification, and correlation extensions"}
  ],
  "security":{"data_classification":["internal","confidential","restricted"],"tenant_boundary":"Tenant scope requires nonempty tenantid; system scope forbids tenantid and requires external authorization","secret_handling":"Only secret references may cross contracts; secret values are prohibited"},
  "unresolved_decisions":[
    {"decision":"Contract testing toolchain and CI enforcement","owner":"Build Orchestration"},
    {"decision":"Runtime auth provider","owner":"Shared Client Platform"}
  ],
  "handoff":{"commit":"pending","artifacts":["nexus-v2-control-tower/"],"tests":["tests/validate-contracts.sh: exit 0"],"limitations":["No production implementation"],"remaining_work":["Independent re-review","Control Tower reconciliation"]}
}
